{
  "$comment": "How art shapes attach to one another. The shape contracts say what a part IS; this says where it goes and how it joins. Derived from the V6/V7 assembly graph produced by the shapes-from-2D project, with every anchor and part rewritten to the art.* id it corresponds to -- all 36 mapped exactly, which is why the join is worth making explicit.",
  "provenance": {
    "source": "3d_shapes_full_package_v7/assembly_graph.json (V6 assembly graph, V7 repackaging)",
    "importedOn": "2026-09-01",
    "note": "Synthetic and rule-based, like the shape contracts it references: joint types and socket offsets are authored construction rules, not measurements of real assets. Angular limits are NOT part of this data, which is why the range-versus-topology rule remains unanswerable."
  },
  "anchors": {
    "art.sphere": {
      "role": "head",
      "sockets": {
        "ear_left": {
          "offset": [
            -0.55,
            0.35,
            0.0
          ]
        },
        "ear_right": {
          "offset": [
            0.55,
            0.35,
            0.0
          ]
        },
        "horn_left": {
          "offset": [
            -0.35,
            0.55,
            0.0
          ]
        },
        "horn_right": {
          "offset": [
            0.35,
            0.55,
            0.0
          ]
        },
        "nose": {
          "offset": [
            0,
            0,
            0.55
          ]
        },
        "mouth": {
          "offset": [
            0,
            -0.2,
            0.5
          ]
        },
        "hat": {
          "offset": [
            0,
            0.6,
            0
          ]
        },
        "neck_bottom": {
          "offset": [
            0,
            -0.55,
            0
          ]
        }
      }
    },
    "art.hemisphere": {
      "role": "head_alt",
      "sockets": {
        "ear_left": {
          "offset": [
            -0.55,
            0.2,
            0
          ]
        },
        "ear_right": {
          "offset": [
            0.55,
            0.2,
            0
          ]
        },
        "nose": {
          "offset": [
            0,
            0.1,
            0.55
          ]
        },
        "hat": {
          "offset": [
            0,
            0.55,
            0
          ]
        },
        "neck_bottom": {
          "offset": [
            0,
            -0.1,
            0
          ]
        }
      }
    },
    "art.cylinder": {
      "role": "body_torso",
      "sockets": {
        "arm_left": {
          "offset": [
            -0.55,
            0.3,
            0
          ]
        },
        "arm_right": {
          "offset": [
            0.55,
            0.3,
            0
          ]
        },
        "leg_left": {
          "offset": [
            -0.25,
            -0.55,
            0
          ]
        },
        "leg_right": {
          "offset": [
            0.25,
            -0.55,
            0
          ]
        },
        "head_top": {
          "offset": [
            0,
            0.55,
            0
          ]
        },
        "tail": {
          "offset": [
            0,
            -0.2,
            -0.5
          ]
        },
        "wing_left": {
          "offset": [
            -0.55,
            0.1,
            0
          ]
        },
        "wing_right": {
          "offset": [
            0.55,
            0.1,
            0
          ]
        }
      }
    },
    "art.cuboid": {
      "role": "body_torso_box",
      "sockets": {
        "arm_left": {
          "offset": [
            -0.55,
            0.2,
            0
          ]
        },
        "arm_right": {
          "offset": [
            0.55,
            0.2,
            0
          ]
        },
        "leg_left": {
          "offset": [
            -0.2,
            -0.55,
            0
          ]
        },
        "leg_right": {
          "offset": [
            0.2,
            -0.55,
            0
          ]
        },
        "head_top": {
          "offset": [
            0,
            0.55,
            0
          ]
        },
        "tail": {
          "offset": [
            0,
            0,
            -0.55
          ]
        },
        "wing_left": {
          "offset": [
            -0.55,
            0.1,
            0
          ]
        },
        "wing_right": {
          "offset": [
            0.55,
            0.1,
            0
          ]
        }
      }
    },
    "art.limb_arm": {
      "role": "arm_segment",
      "sockets": {
        "paw_end": {
          "offset": [
            0,
            -0.55,
            0
          ]
        },
        "child_limb": {
          "offset": [
            0,
            -0.45,
            0
          ]
        }
      }
    }
  },
  "parts": {
    "art.ear_pointed": {
      "attachesTo": [
        "art.sphere",
        "art.hemisphere"
      ],
      "socketNames": [
        "ear_left",
        "ear_right"
      ],
      "jointType": "rigid",
      "canMirror": true,
      "scaleRelativeToAnchor": [
        0.22,
        0.35,
        0.18
      ],
      "pivotOffset": [
        0,
        -0.5,
        0
      ],
      "lodDisappearsAt": null
    },
    "art.ear_rounded": {
      "attachesTo": [
        "art.sphere",
        "art.hemisphere"
      ],
      "socketNames": [
        "ear_left",
        "ear_right"
      ],
      "jointType": "rigid",
      "canMirror": true,
      "scaleRelativeToAnchor": [
        0.25,
        0.28,
        0.12
      ],
      "pivotOffset": [
        0,
        -0.5,
        0
      ],
      "lodDisappearsAt": null
    },
    "art.ear_floppy": {
      "attachesTo": [
        "art.sphere",
        "art.hemisphere"
      ],
      "socketNames": [
        "ear_left",
        "ear_right"
      ],
      "jointType": "hinge",
      "canMirror": true,
      "scaleRelativeToAnchor": [
        0.2,
        0.45,
        0.1
      ],
      "pivotOffset": [
        0,
        -0.5,
        0
      ],
      "lodDisappearsAt": null
    },
    "art.horn_straight": {
      "attachesTo": [
        "art.sphere",
        "art.hemisphere"
      ],
      "socketNames": [
        "horn_left",
        "horn_right"
      ],
      "jointType": "rigid",
      "canMirror": true,
      "scaleRelativeToAnchor": [
        0.12,
        0.5,
        0.12
      ],
      "pivotOffset": [
        0,
        -0.5,
        0
      ],
      "lodDisappearsAt": 3
    },
    "art.horn_curved": {
      "attachesTo": [
        "art.sphere",
        "art.hemisphere"
      ],
      "socketNames": [
        "horn_left",
        "horn_right"
      ],
      "jointType": "rigid",
      "canMirror": true,
      "scaleRelativeToAnchor": [
        0.12,
        0.5,
        0.12
      ],
      "pivotOffset": [
        0,
        -0.5,
        0
      ],
      "lodDisappearsAt": 3
    },
    "art.antler": {
      "attachesTo": [
        "art.sphere"
      ],
      "socketNames": [
        "horn_left",
        "horn_right"
      ],
      "jointType": "rigid",
      "canMirror": true,
      "scaleRelativeToAnchor": [
        0.4,
        0.7,
        0.3
      ],
      "pivotOffset": [
        0,
        -0.5,
        0
      ],
      "lodDisappearsAt": 2
    },
    "art.tusk": {
      "attachesTo": [
        "art.sphere",
        "art.hemisphere",
        "art.snout"
      ],
      "socketNames": [
        "mouth",
        "nose"
      ],
      "jointType": "rigid",
      "canMirror": true,
      "scaleRelativeToAnchor": [
        0.08,
        0.35,
        0.08
      ],
      "pivotOffset": [
        0,
        -0.5,
        0
      ],
      "lodDisappearsAt": 3
    },
    "art.snout": {
      "attachesTo": [
        "art.sphere",
        "art.hemisphere"
      ],
      "socketNames": [
        "nose"
      ],
      "jointType": "rigid",
      "canMirror": false,
      "scaleRelativeToAnchor": [
        0.4,
        0.3,
        0.3
      ],
      "pivotOffset": [
        0,
        0,
        -0.5
      ],
      "lodDisappearsAt": null
    },
    "art.beak": {
      "attachesTo": [
        "art.sphere",
        "art.hemisphere"
      ],
      "socketNames": [
        "mouth",
        "nose"
      ],
      "jointType": "hinge",
      "canMirror": false,
      "scaleRelativeToAnchor": [
        0.3,
        0.22,
        0.35
      ],
      "pivotOffset": [
        0,
        0.1,
        -0.5
      ],
      "lodDisappearsAt": null
    },
    "art.hat_brim": {
      "attachesTo": [
        "art.sphere",
        "art.hemisphere"
      ],
      "socketNames": [
        "hat"
      ],
      "jointType": "rigid",
      "canMirror": false,
      "scaleRelativeToAnchor": [
        1.3,
        0.15,
        1.3
      ],
      "pivotOffset": [
        0,
        -0.5,
        0
      ],
      "lodDisappearsAt": null
    },
    "art.crown": {
      "attachesTo": [
        "art.sphere",
        "art.hemisphere"
      ],
      "socketNames": [
        "hat"
      ],
      "jointType": "rigid",
      "canMirror": false,
      "scaleRelativeToAnchor": [
        1.1,
        0.5,
        1.1
      ],
      "pivotOffset": [
        0,
        -0.5,
        0
      ],
      "lodDisappearsAt": null
    },
    "art.collar": {
      "attachesTo": [
        "art.sphere",
        "art.cylinder",
        "art.cuboid"
      ],
      "socketNames": [
        "neck_bottom",
        "head_top"
      ],
      "jointType": "rigid",
      "canMirror": false,
      "scaleRelativeToAnchor": [
        1.2,
        0.2,
        1.2
      ],
      "pivotOffset": [
        0,
        0,
        0
      ],
      "lodDisappearsAt": null
    },
    "art.limb_arm": {
      "attachesTo": [
        "art.cylinder",
        "art.cuboid"
      ],
      "socketNames": [
        "arm_left",
        "arm_right"
      ],
      "jointType": "ball_socket",
      "canMirror": true,
      "scaleRelativeToAnchor": [
        0.28,
        0.7,
        0.28
      ],